{
  "schemaVersion": "finance-component-development-support.v0.1",
  "subject": {
    "kind": "capability-pack", "id": "account-balance-readonly", "version": "0.1.0",
    "source": "repo://capability-packs/account-balance-readonly",
    "digest": "sha256:4db0ba8415ed048c2e452f929f58036dd2de2c224f8bed5da3151b53e87dd407"
  },
  "scope": {"capabilityIds": ["account.balance.query"]},
  "methodCases": [{"name": "业务事实核验 1", "query": "请查询我的账户余额", "expectedTerms": []}],
  "caseRefs": [],
  "commands": [{
    "name": "只读装配矩阵检查（不代表此组件业务通过）",
    "command": "python3 -m unittest discover -s engineering -p test_readonly_matrix.py",
    "sourceCommit": "2436d8e0d5e0a4e9de89b25a6079b1851b6a7e9e", "workingDirectory": "repo://"
  }]
}
