{
  "schemaVersion": "finance-component-development-support.v0.1",
  "subject": {
    "kind": "domain-pack", "id": "cashflow-customer-self-service", "version": "0.1.3",
    "source": "repo://domain-packs/cashflow/customer-self-service",
    "digest": "sha256:c09fc4c25f547a1ef8d0a29657954cfeba9c3916f363b72e12d451e41634eb88"
  },
  "scope": {"capabilityIds": ["finance.spending-analysis.query", "finance.transaction-summary.query"]},
  "methodCases": [
    {"name": "业务事实核验 1", "query": "请查询 2026-08 收支汇总", "expectedTerms": []},
    {"name": "业务事实核验 2", "query": "请查询 2026-08 收支分类", "expectedTerms": []}
  ],
  "caseRefs": [
    {"source":"repo://conformance/fixtures/cashflow/source/summary.json","digest":"sha256:d6a036375187a2bc630473bbaaff00664c207bdbfc10d7a76451d917b3df3823","format":"non-ai-banking-cashflow-summary-fixture"},
    {"source":"repo://conformance/fixtures/cashflow/source/summary-policy.json","digest":"sha256:af773f5d7cc8d508f1c49fe0db2954924cbe4be49400d9f42e1b64ac9544edd6","format":"non-ai-banking-cashflow-policy-fixture"},
    {"source":"repo://conformance/fixtures/cashflow/source/analysis.json","digest":"sha256:b3fdfa31a3ef5a5fe2d7052ac207970eb411d8de0897863668667c0bbb107245","format":"non-ai-banking-cashflow-analysis-fixture"},
    {"source":"repo://conformance/fixtures/cashflow/source/analysis-policy.json","digest":"sha256:353b1233f3c63636776cb3ca427697dcddd9ec0575f0626e2581c8077679a4bf","format":"non-ai-banking-cashflow-policy-fixture"},
    {"source":"repo://conformance/fixtures/cashflow/v0.1/valid/missing.json","digest":"sha256:ad34a38267d458eac20518e8e682b8ee1e10186f45594eca20ddf1e817f488ff","format":"finance-cashflow-facts.v0.1"}
  ],
  "commands": [
    {
      "name": "收支Provider：正常摘要/分类、错主体/撤权、缺权限/月份、缺失与冲突数据、零写入",
      "command": "mvn -B -ntp -pl providers/non-ai-banking -am -Dtest=CashflowProviderTest -Dsurefire.failIfNoSpecifiedTests=false test",
      "sourceCommit": "75aec9c92058088550e479bfa6af7ac7d065354e", "workingDirectory": "repo://"
    },
    {
      "name": "收支合同：共享正反例、金额精度、缺失分类、时间范围（非模型质量评测）",
      "command": "mvn -B -ntp -pl packages/java/cashflow -am -Dtest=CashflowContractTest -Dsurefire.failIfNoSpecifiedTests=false test",
      "sourceCommit": "75aec9c92058088550e479bfa6af7ac7d065354e", "workingDirectory": "repo://"
    }
  ]
}
